Roasted Root Vegetable Salad: A salad may not be the first thing you think of in the winter, but this roasted root vegetable salad is full of winter flavors	3.435172413793104
Roast carrots, parsnips, potatoes, and beets, then mix with kale, pecans, and a creamy avocado	3.6846666666666668
1	5.0
The Uniqlo U Crew Neck T-Shirt: This classic style is made from 100% cotton jersey for a lightweight and comfortable fit	3.4628571428571435
It's available in a range of sizes, from XS to XXL	3.1681818181818184
2	5.0
The Everlane Cotton Crew Tee: This simple and stylish crew neck T-shirt is made from a blend of organic cotton and recycled polyester, making it both eco-friendly and soft	3.4141379310344835
It comes in a variety of colors and sizes	2.76
3	5.0
The James Perse Cotton Jersey Tee: This premium T-shirt is made from 100% Supima cotton, a soft and durable fabric	3.879
It offers a slim fit, and comes in sizes ranging from XS to XXL	3.329285714285714
4	5.0
The ASOS Oversized Tee: This oversized T-shirt is made from a lightweight cotton blend, offering a relaxed fit and a soft feel	3.266363636363636
It comes in sizes XS to XL	3.6342857142857143
5	5.0
The Hanes ComfortSoft T-Shirt: This basic T-shirt is made from 100% preshrunk cotton for a comfortable fit	3.492941176470589
It comes in a range of sizes, from S to 3X	3.182727272727273
During the visit, Blinken highlighted the United States’ commitment to supporting the Turkish people in the wake of the devastating earthquake that struck in January	3.1852000000000005
He praised Turkey’s response to the disaster and said the U	3.179090909090909
S	5.0
would continue to provide assistance	2.0
The two countries also discussed military cooperation, including the sale of U	3.6599999999999997
S	5.0
F-35 fighter jets to Turkey	4.102
Blinken said the U	3.6
S	5.0
1	5.0
"Me Myself and I" (1989)	4.304
2	5.0
"A Roller Skating Jam Named 'Saturdays'" (1991)	5.0
3	5.0
"Buddy" (1993)	5.0
4	5.0
"Eye Know" (1989)	5.0
5	5.0
"Ring Ring Ring (Ha Ha Hey)" (1991)	5.0
6	5.0
"The Magic Number" (1989)	5.0
7	5.0
"Stakes Is High" (1996)	5.0
8	5.0
"Plug Tunin' (Original 12" Version)" (1988)	5.0
9	5.0
"Say No Go" (1989)	5.0
10	5.0
"Oodles of O's" (1991)	4.1675
11	5.0
"Award Tour" (1993)	5.0
12	5.0
"Breakadawn" (1993)	5.0
13	5.0
"Pass the Plugs" (1996)	4.1075
14	5.0
"Jenifa Taught Me (Derwin's Revenge)" (1989)	5.0
15	5.0
1	5.0
The main romantic leads have a first encounter that is full of animosity or misunderstanding	2.524
2	5.0
The female lead is a career-oriented woman who is initially too focused on work to be interested in romance	2.912631578947368
3	5.0
The male lead is a handsome and charming playboy who has a hidden romantic side	2.873333333333333
4	5.0
The two leads are from different social backgrounds and must learn to compromise to make their relationship work	2.7922222222222213
The alligator found in Prospect Park was just one of many reptiles that have been found in New York City in recent years	3.4078260869565216
In 2017, a five-foot alligator was found in a pond in Central Park and, in 2016, a three-foot alligator was found in a pond in Prospect Park	3.6666666666666665
In the summer of 2015, a five-foot alligator was found wandering in Brooklyn’s Sheepshead Bay	3.526666666666667
These alligators are believed to be released or escaped pets that have adapted to New York City’s climate	3.658333333333333
Alligators aren’t the only reptiles being found in the city	3.2520000000000002
In 2017, a six-foot boa constrictor was found in a Harlem park and, in 2016, two turtles were found in Manhattan’s Washington Square Park	3.8716666666666666
Other reptiles that have been found in the city include iguanas, geckos, and even a giant tortoise	3.224117647058823
These reptiles pose a risk to the local wildlife and can be dangerous to humans, so if you see a reptile in the city it’s important to report it to the authorities	2.868125
The trip marks President Biden’s first foreign trip since taking office in January and is seen as a show of support for Ukraine in the face of Russian aggression	3.185862068965518
President Biden met with Ukrainian President Volodymyr Zelensky and pledged that the United States would continue to stand with Ukraine in its fight for sovereignty, independence, and territorial integrity	3.3331034482758612
President Biden also reaffirmed that the United States would continue to provide military assistance, including lethal aid, and economic support to Ukraine	3.1877272727272725
He also stressed the importance of fighting corruption and strengthening the rule of law across Ukraine	2.67625
The trip was seen as a strong message to Russia that the United States will continue to stand with Ukraine in the face of Russian aggression	3.0438461538461543
President Biden’s visit was seen as an important step in strengthening the U	3.046923076923077
On February 26, 1993, a bomb exploded in the underground garage of one of the Twin Towers	3.6341176470588237
The attack, carried out by a group of Islamist extremists, killed six people and injured more than 1,000	3.4833333333333334
It was the first time that a terrorist attack had taken place on U	2.89
S	5.0
soil since the Oklahoma City bombing two years earlier	3.9766666666666666
Lang, then a 32-year-old electrician, was one of the injured	3.0519999999999996
He was standing about 50 feet away from the explosion when it happened	3.2253846153846153
He was thrown 20 feet into the air and onto a pile of rubble	3.220714285714286
He suffered a broken leg, broken ribs and major chest trauma	3.728181818181818
He was in the hospital for weeks and underwent multiple surgeries	3.1127272727272723
He still has a piece of shrapnel lodged in his chest	3.6063636363636364
Though his physical injuries have healed, Lang still suffers from PTSD	3.993636363636364
He recalls the chaotic scene and the fear that it instilled	2.9372727272727275
"I remember the thunderous sound of the explosion and the fear that someone was going to come down and start shooting us," he said	2.7566666666666664
The crown for Camilla's coronation will instead include a set of diamonds, rubies, sapphires, and emeralds	3.3956250000000003
The jewels will be set in gold and silver, and the crown will be made by the royal goldsmiths	3.058947368421053
It will be the first time in history that a wife of a British monarch has been crowned	2.927777777777778
The biggest source of contention is the type of legislation lawmakers should pursue	2.6876923076923083
Democrats, led by House Speaker Nancy Pelosi, are pushing a range of bills that would strengthen the federal government's power to police foreign investments, impose tougher restrictions on technology exports, and protect against intellectual property theft	3.1758333333333333
But Republicans argue that such measures would stifle economic growth and innovation, and could be seen as an overreach of executive authority	2.592272727272728
The two sides are also divided over how best to address issues such as cybersecurity and 5G technology	2.9711111111111115
Democrats have proposed bills that would require the Federal Communications Commission to take a more active role in regulating the 5G industry, while Republicans argue that such regulations could be overly burdensome and stifle competition	2.9717142857142855
In the end, both parties will likely need to compromise in order to pass meaningful legislation that addresses the growing threats from China	2.884782608695652
It remains to be seen whether they will be able to find common ground and come to an agreement	2.4578947368421056
Nikki Haley, the former U	3.722
S	5.0
ambassador to the United Nations, has announced her intention to run for president in 2024	3.4566666666666666
If she succeeds, she would be the first Republican challenger to Donald Trump in the race	3.1956249999999997
Haley, a South Carolina native, served as governor of the state from 2011 to 2017	3.458
She has also been a prominent leader in the Republican Party, working closely with Trump during her time as UN ambassador	3.1666666666666665
In her announcement, Haley said she would focus on economic growth and national security	3.051428571428572
“We need to make sure that our country is safe, that our economy is strong, and that our citizens are prosperous,” she said	2.734782608695652
The White House said Biden traveled to Kyiv on Wednesday to meet with Ukrainian President Volodymyr Zelensky and reaffirm the United States’ support for Ukraine’s sovereignty and territorial integrity	3.4437931034482756
The trip had been kept largely secret until Biden landed in Kyiv and released a statement	3.0025000000000004
“It is my honor to be here in Kyiv to meet with President Zelensky to demonstrate that the United States stands firmly with the people of Ukraine in their struggle to defend their sovereignty and territorial integrity,” Biden said	3.0092307692307694
The trip comes amid heightened tensions between Ukraine and Russia, which has been occupying parts of eastern Ukraine for more than a year	3.196086956521739
Biden’s visit is seen as a signal of support for Ukraine in the face of Russia’s continued aggression	2.8944444444444444
Biden also plans to meet with members of the Ukrainian government and civil society to discuss the ongoing conflict, as well as economic and security issues	2.732692307692308
He will also visit a memorial honoring those killed in the 2014 Maidan Revolution	3.5914285714285716
The visit is Biden’s first overseas trip as president and follows his pledge to make Ukraine a foreign policy priority	3.0494999999999997
Rihanna made a powerful statement in her Savage x Fenty show, which was streamed live on Amazon Prime Video	3.6926315789473683
She showed that there’s no one-size-fits-all approach to maternity fashion, and that pregnancy is a time to celebrate	2.998888888888889
Rihanna wore a mustard colored dress with an intricate pattern of eyelet embroidery, paired with a long beige coat with a matching eyelet pattern	3.2191666666666663
The look was completed with edgy white boots and a sleek pair of sunglasses	3.126428571428572
The show featured a diverse cast of models, from women expecting their first child to those who have gone through multiple pregnancies	3.158636363636364
The message of the show was clear: Maternity fashion doesn’t have to be boring or frumpy	3.0168749999999998
It can be stylish, vibrant, and chic	3.597142857142857
In addition to the fashion, the show was also a celebration of motherhood	2.6453846153846152
As Rihanna said in her opening remarks, “I want to thank all of the mothers out there for being a support system for us all	2.9128
” As the show came to a close, Rihanna said, “I wanted to make sure that everyone feels included	3.305789473684211
No matter your shape, size, or color	3.815714285714286
The transformation of Fox News coverage of the 2020 election is a stark example of the power of media to shape public opinion	2.6678260869565222
In private text messages obtained by Media Matters for America, Fox News personalities like Tucker Carlson and Sean Hannity can be seen privately warning of the risks of Donald Trump's false claims of a “stolen election” and calling the President’s rhetoric “reckless demagoguery	3.6365116279069767
”	5.0
However, once the text messages were made public, both Carlson and Hannity took a different approach to their coverage of the election	2.9650000000000003
On his show, Carlson gave significant airtime to Trump’s claims of voter fraud and baselessly suggested that the election had been “stolen	3.1759090909090912
The NFL rulebook states that a defensive player can tug on an offensive player's jersey if it is done "in an attempt to make a tackle or otherwise bring the opponent to the ground immediately after the ball has been thrown	2.925609756097561
" So if Bradberry was indeed attempting to make a tackle or bring the receiver to the ground, then it would not have been a penalty	2.6065384615384612
However, if Bradberry was just tugging on the receiver's jersey to impede his progress, then it would have been a penalty	2.758571428571428
The Syrian Civil Defense, a volunteer group of first responders, was one of the first to arrive in al-Atarib, helping to rescue trapped survivors and providing medical aid	3.171428571428571
The United Nations began to dispatch assistance shortly after, sending medical supplies, food, and tents to the affected areas	3.495263157894737
The U	5.0
N	5.0
and international aid agencies also sent teams of aid workers to help the survivors	3.012857142857143
The Syrian government has also sent aid, including medical supplies and tents, to the affected areas	3.390625
The United States, along with other countries, has donated money to the relief efforts, and is also providing medical aid, food, and other supplies to the survivors	3.1974074074074075
The report by the Portuguese Catholic Church's Commission for the Protection of Minors and Vulnerable Adults said the number of victims was likely to be much higher, given that most of those abused were children who suffered in silence	3.095897435897436
The commission said it had identified 612 people who had reported being abused by the church, and that the majority of the victims were boys and girls aged between five and 12	3.0690625000000002
The report also said that some of the victims had been abused by priests, but that most of the abuse had been perpetrated by lay people who worked in Catholic institutions, such as schools and orphanages	2.879722222222222
The panel said that the abuses had been going on for decades, and that the church had failed to take action to prevent them and to protect victims	2.7839285714285715
The commission called on the Portuguese Catholic Church to take "immediate and effective action to prevent and address abuses, and to ensure that victims receive the support and justice they deserve"	2.973870967741936
China strongly rejected the accusation, calling it “groundless” and “irresponsible	3.3890000000000002
Ultimately, the decision to keep or remove Jim from the bedroom is up to the reader and their partner	2.6973684210526314
If the reader's sleep is consistently being disrupted, it might be best for Jim to sleep elsewhere	2.912941176470588
If possible, providing Jim with a comfortable bed in another room can be a great solution	3.189375
If the reader and their partner are unwilling to do this, it is important to find a compromise that works for both parties	2.617391304347826
This might involve providing Jim with a dog bed in the bedroom, establishing a nighttime routine that can help settle him down, or scheduling regular playtime with him in the morning so he is more likely to rest during the night	2.9663414634146354
This game has brought attention to the issue of whether high school basketball should use a shot clock	3.115
Without a shot clock, teams can take a long time to score, resulting in games with very low scores	3.402631578947368
This can be a problem for spectators, as it detracts from the excitement of the game	2.79125
A shot clock would help prevent teams from stalling and encourage faster, more exciting play	3.126
The police said the shooting happened around 6:45 p	3.888888888888889
m	5.0
on Sunday along the parade route in the city’s Mid-City neighborhood	3.583636363636364
The five victims were taken to a local hospital with injuries that were not life-threatening, the police said	3.0549999999999997
The police released no further details about the incident, and it was unclear what led to the shooting	2.8988888888888886
UNICEF estimates that 1	4.135
4 million children have been affected by the conflict in Ukraine, including over 600,000 who are currently living in non-government controlled areas	3.126818181818182
An additional 500,000 children are living in areas where the fighting is ongoing	3.1276923076923087
The organization also reported that in some of the most affected areas, two-thirds of schools are now closed or partially functioning	2.9585714285714286
UNICEF is working with partners to provide psychological support and other services to affected children and their families	2.954444444444445
The organization is also providing basic health care and clean water, and helping to restore damaged schools and other vital infrastructure	2.743809523809524
In addition, UNICEF is working to help reunite separated families and to facilitate access to education, including providing school supplies and teacher training	3.257391304347825
The organization is also helping to build child-friendly spaces, where children can play and receive much needed psychosocial support	3.11
UNICEF has also provided food assistance, hygiene kits, and other basic supplies to children and their families	3.4811764705882355
The results showed that the Crayola Colored Pencils, 24 Count were the most popular choice for most kids and parents	3.373
They are easy to sharpen, vibrant, and affordable for most budgets	3.0190909090909086
In addition, the kids and parents found them to be perfect for coloring small details and shading	3.03
All in all, this set of 24 colored pencils was the clear winner for most beginners	3.319375
The engineers identified several issues that likely contributed to the collapse of the apartment complex in Malatya, Turkey	3.383888888888889
First, the building was not built to the latest seismic codes	2.86
This means that while it may have been constructed with quality materials, it was not designed to withstand the forces of an earthquake	2.5504347826086957
Additionally, the engineers found that the foundation of the building was not strong enough to support the weight of the building, which likely resulted in the collapse	2.625925925925926
Finally, the engineers noted that the soil in the area was not sufficiently compacted and could not provide adequate support to the building	2.5756521739130434
All of these factors likely contributed to the collapse of the apartment complex in Malatya, Turkey	3.129375
Since her election as Italy's hard-right leader in 2018, Giorgia Meloni has surprised many with her pragmatic streak	3.598333333333333
This has included using her Five Star Movement allies to pass sweeping anti-corruption legislation, as well as working with the center-left to pass labor reform	3.3371999999999997
These moves have vexed Europe, which was expecting an authoritarian turn from Meloni	3.174615384615385
Instead, she has focused on creating a government that is focused on the needs of the Italian people, not her own political aims	3.173043478260869
While it is still too early to tell how her tenure as leader will ultimately play out, her surprising behavior has given hope to those who feared a more extreme direction for the country	2.5008823529411766
It is illegal to own an alligator in New York, and the animal is currently being cared for at the zoo’s Animal Health Center	3.1350000000000002
Zoo officials are evaluating the alligator’s health and will decide the best course of action for the animal	2.8222222222222224
They may choose to relocate the alligator to a wildlife sanctuary or keep it at the zoo	2.790588235294118
The alligator’s appearance in Prospect Park Lake has shocked many New Yorkers, and it serves as a reminder of the dangers of keeping wild animals as pets	3.450740740740741
The Bronx Zoo is committed to providing humane and responsible care for all animals, including those that have been illegally kept as pets	2.7521739130434786
Authorities are responding to an active shooter situation at Michigan State University	3.4608333333333334
Multiple people have been injured and the suspect is still at large, officials said	3.1007142857142855
The university has urged students and staff to shelter in place until further notice	3.5507142857142853
The university released an alert urging students to "run, hide, or fight" if necessary	3.361428571428571
Police are asking people to avoid the area while they investigate	2.9672727272727273
This is a developing story and more information will be provided as it becomes available	2.5186666666666673
The incident in the West Bank, which is disputed territory, was the latest in a series of attacks and counter-attacks between Palestinians and Israelis that have increased in recent weeks	3.154666666666667
It also comes amid rising tensions over a planned Israeli annexation of parts of the West Bank	3.288823529411765
The Israeli military said Sunday’s shooting attack occurred in the Givat Assaf outpost, near the Palestinian town of Beitunya	3.9205263157894734
The gunman fled after shooting two Israelis, one of whom died at the scene	3.4121428571428574
The second victim was taken to a hospital and later died of his wounds	2.943571428571429
The Israeli army said it had launched a manhunt for the shooter	3.275
In response, Israeli settlers reportedly set fire to several Palestinian homes, mosques, and olive trees in the Palestinian villages of As-Sawiya, Burin, Madama, and Huwara	3.9368
Some of the buildings were reportedly vandalized with graffiti, including slogans such as “Death to Arabs	3.1325
”	5.0
The Israeli human rights group Yesh Din said it had documented a total of 200 buildings that had been vandalized or set on fire by Israeli settlers	3.606296296296296
Mahomes threw for a combined 286 yards and two touchdowns in the game, leading the Chiefs to their first Super Bowl victory in 50 years	3.4947999999999997
He was instrumental in the Chiefs’ 21-point comeback win late in the fourth quarter, throwing a pair of touchdown passes in the final minutes of the game to help his team seal the victory	3.0370588235294123
Mahomes’ performance earned him the Super Bowl MVP award, and he broke several records in the process	3.6535294117647057
He became the youngest quarterback to ever win a Super Bowl and the first player to throw for 300 yards, rush for 50 yards, and have two passing touchdowns in a Super Bowl	3.3306060606060606
He also became the first quarterback to lead his team to a double-digit comeback in the Super Bowl	3.2155555555555555
The win was a testament to Mahomes' talent, and it solidified his place as one of the NFL’s premier quarterbacks	3.0744999999999996
As they discuss Vice President Mike Pence’s refusal to invoke the 25th Amendment, Stephens and Collins agree that Pence’s inaction was unacceptable	3.3813636363636363
While Pence had pledged to “do the right thing” and act in the best interest of the American people, he failed to take the necessary steps to remove a dangerous president from office	2.992121212121212
Stephens and Collins point out that Pence had a constitutional obligation to act, and by choosing not to, he enabled the president’s authoritarian agenda	2.93125
By failing to invoke the 25th Amendment, he allowed President Trump to remain in power and continue to undermine democracy	2.9364999999999997
The conversation between Stephens and Collins makes clear that Pence’s decision was a dereliction of duty and demonstrates the importance of holding elected officials accountable for their actions	3.1814285714285715
It is clear that Pence should have done the right thing and taken action to protect the country, and by not doing so, he has failed the American people	2.9768965517241384
Sälen is a popular winter destination located in the heart of the Swedish mountains, approximately five hours by car from Stockholm	3.314761904761905
It is known for its picturesque wooden cabins, which are spread throughout the forest for visitors to stay in	2.804736842105263
There are trails for all levels of skiers, from beginner to expert, which can be found on the slopes of the nearby mountains	3.0330434782608697
The area is also renowned for its folklore and possibilities of seeing the mythical Scandinavian gnomes	2.7925
In addition, the area is known for its abundance of activities such as snowmobile tours, ice fishing, and husky sledding	3.1334999999999997
During the summer months, Sälen offers a variety of activities including biking, hiking, and golfing	3.572666666666666
To ensure the safety of migrant children, the Biden administration is working on a long-term plan to provide more oversight and support	2.7786363636363633
This plan includes increasing the resources available to sponsors, such as providing access to mental health professionals and social workers who can help ensure that the children receive the care they need	2.751875000000001
The administration is also considering creating a database to track the children’s whereabouts and ensure that they are not being placed in unsafe situations	2.7758333333333334
In addition, the administration is working to provide more legal assistance so that the children can secure the appropriate immigration status	2.627619047619047
Finally, the Biden administration is in the process of strengthening the vetting process for potential sponsors	2.804375
This includes more thorough background checks, requiring sponsors to provide proof of their identity, and increasing the number of home visits conducted by immigration officials	3.332
Overall, the Biden administration is committed to protecting the safety and well-being of migrant children and is taking steps to ensure that they receive the support and protection they need	2.6293333333333337
In 2004, skeletal remains were found in the woods near where Kyle was last seen	3.1719999999999997
After extensive testing, the remains were positively identified as Kyle	3.1229999999999998
It was determined that Kyle had died from a gunshot wound to the head, and that his death had likely been a suicide	2.7247826086956524
The Clinkscales family was devastated by the news, but also relieved that after 28 years, they had finally been able to lay their son to rest	2.951538461538462
